{
  "schema_version": "1.6.0",
  "domain": "library_rights_cleared_assets",
  "verified_on": "2026-10-05",
  "text_records": [
    {
      "key": "theophan-thoughts-every-day",
      "title": "Мысли на каждый день года по церковным чтениям из Слова Божия",
      "work_type": "theology",
      "author_key": "theophan-the-recluse",
      "author_name": "Святитель Феофан Затворник",
      "author_aliases": [
        "Феофан Затворник"
      ],
      "edition_title": "Викитека — электронная публикация",
      "language": "ru",
      "publisher": "Викитека",
      "publication_year": null,
      "asset_kind": "full_text",
      "storage_mode": "external_url",
      "external_url": "https://ru.wikisource.org/wiki/Мысли_на_каждый_день_года_по_церковным_чтениям_из_Слова_Божия_(Феофан-Затворник)",
      "rights_status": "public_domain_verified",
      "license_url": null,
      "copyright_notice": "Викитека помечает исходное произведение как перешедшее в общественное достояние в России и в юрисдикциях с life+70 или меньшим сроком.",
      "rights_evidence_url": "https://ru.wikisource.org/wiki/Мысли_на_каждый_день_года_по_церковным_чтениям_из_Слова_Божия_(Феофан-Затворник)",
      "source_url": "https://ru.wikisource.org/wiki/Мысли_на_каждый_день_года_по_церковным_чтениям_из_Слова_Божия_(Феофан-Затворник)"
    },
    {
      "key": "philaret-longer-catechism",
      "title": "Пространный христианский катихизис Православной Кафолической Восточной Церкви",
      "work_type": "catechesis",
      "author_key": "philaret-drozdov",
      "author_name": "Святитель Филарет (Дроздов), митрополит Московский",
      "author_aliases": [
        "Филарет Московский",
        "Филарет (Дроздов)"
      ],
      "edition_title": "Викитека — электронная публикация катихизиса",
      "language": "ru",
      "publisher": "Викитека",
      "publication_year": 1823,
      "asset_kind": "full_text",
      "storage_mode": "external_url",
      "external_url": "https://ru.wikisource.org/wiki/Пространный_христианский_катихизис_Православной_Кафолической_Восточной_Церкви",
      "rights_status": "external_link_only",
      "license_url": null,
      "copyright_notice": "Историческое произведение святителя Филарета находится в общественном достоянии; текущая электронная страница указывает редакционную подготовку издания 2006 года. Права точной электронной редакции требуют отдельной проверки, поэтому ПМ хранит только внешнюю ссылку и metadata.",
      "rights_evidence_url": "https://ru.wikisource.org/wiki/Пространный_христианский_катихизис_Православной_Кафолической_Восточной_Церкви",
      "source_url": "https://ru.wikisource.org/wiki/Пространный_христианский_катихизис_Православной_Кафолической_Восточной_Церкви",
      "work_rights_status": "public_domain_verified"
    },
    {
      "key": "philaret-scripture-translations",
      "title": "О догматическом достоинстве и охранительном употреблении переводов Священного Писания",
      "work_type": "theology",
      "author_key": "philaret-drozdov",
      "author_name": "Святитель Филарет (Дроздов), митрополит Московский",
      "author_aliases": [
        "Филарет Московский",
        "Филарет (Дроздов)"
      ],
      "edition_title": "Викитека — транскрипция дореформенного издания, Прибавления к творениям Святых Отцев, XVII, 1858, с. 452–484",
      "language": "ru",
      "publisher": "Викитека",
      "publication_year": 1858,
      "asset_kind": "full_text",
      "storage_mode": "local_text",
      "external_url": "https://ru.wikisource.org/w/index.php?title=О_догматическом_достоинстве_и_охранительном_употреблении_переводов_Священного_Писания_(свят._Филарет)/ДО&oldid=5666262",
      "rights_status": "open_license",
      "license_url": "https://creativecommons.org/licenses/by-sa/4.0/",
      "copyright_notice": "Оригинальный авторский текст — общественное достояние. Электронная транскрипция: участники Викитеки, CC BY-SA 4.0. Сохранены орфография и ошибки источника; удалены только навигация и элементы сайта. Полная выбранная электронная публикация, без заявления о критической выверке.",
      "rights_evidence_url": "https://ru.wikisource.org/w/index.php?title=О_догматическом_достоинстве_и_охранительном_употреблении_переводов_Священного_Писания_(свят._Филарет)/ДО&oldid=5666262",
      "source_url": "https://ru.wikisource.org/w/index.php?title=О_догматическом_достоинстве_и_охранительном_употреблении_переводов_Священного_Писания_(свят._Филарет)/ДО&oldid=5666262",
      "work_rights_status": "public_domain_verified",
      "local_source_file": "data/library_sources/texts/philaret-scripture-translations.json",
      "content_path": "library/texts/philaret-scripture-translations.txt",
      "content_sha256": "24761d6d674267d0fb3d3c2fbadcbd1a6eb0d7f37d9139c1efd1502f3024f14b",
      "content_size_bytes": 81962,
      "source_revision": "5666262",
      "verified_on": "2026-10-05"
    },
    {
      "key": "ignatius-on-orthodoxy",
      "title": "О Православии",
      "work_type": "theology",
      "author_key": "ignatius-brianchaninov",
      "author_name": "Святитель Игнатий (Брянчанинов)",
      "author_aliases": [
        "Игнатий Брянчанинов"
      ],
      "edition_title": "Викитека — электронная публикация",
      "language": "ru",
      "publisher": "Викитека",
      "publication_year": 1857,
      "asset_kind": "full_text",
      "storage_mode": "external_url",
      "external_url": "https://ru.wikisource.org/wiki/О_Православии_(Брянчанинов)",
      "rights_status": "external_link_only",
      "license_url": null,
      "copyright_notice": "В электронной публикации есть поздние комментарии со ссылками на издания 1996 года. Общественное достояние авторского текста 1857 года не доказывает права редакционного аппарата. Локальная копия не включается до проверки точной редакции.",
      "rights_evidence_url": "https://ru.wikisource.org/wiki/О_Православии_(Брянчанинов)",
      "source_url": "https://ru.wikisource.org/wiki/О_Православии_(Брянчанинов)"
    },
    {
      "key": "ignatius-word-on-man",
      "title": "Слово о человеке",
      "work_type": "theology",
      "author_key": "ignatius-brianchaninov",
      "author_name": "Святитель Игнатий (Брянчанинов)",
      "author_aliases": [
        "Игнатий Брянчанинов"
      ],
      "edition_title": "Викитека — электронная публикация",
      "language": "ru",
      "publisher": "Викитека",
      "publication_year": 1876,
      "asset_kind": "full_text",
      "storage_mode": "external_url",
      "external_url": "https://ru.wikisource.org/wiki/Слово_о_человеке_(Брянчанинов)",
      "rights_status": "external_link_only",
      "license_url": null,
      "copyright_notice": "В источнике указана первая публикация в 1995 году; имеются предисловие и редакторские примечания 1995 года. Статус точного издания требует отдельной проверки, возраст автора не доказывает права всей версии. Локальная копия не включается до проверки точной редакции.",
      "rights_evidence_url": "https://ru.wikisource.org/wiki/Слово_о_человеке_(Брянчанинов)",
      "source_url": "https://ru.wikisource.org/wiki/Слово_о_человеке_(Брянчанинов)"
    },
    {
      "key": "ignatius-garden-in-winter",
      "title": "Сад во время зимы",
      "work_type": "sermon",
      "author_key": "ignatius-brianchaninov",
      "author_name": "Святитель Игнатий (Брянчанинов)",
      "author_aliases": [
        "Игнатий Брянчанинов"
      ],
      "edition_title": "Викитека — электронная публикация",
      "language": "ru",
      "publisher": "Викитека",
      "publication_year": 1843,
      "asset_kind": "full_text",
      "storage_mode": "external_url",
      "external_url": "https://ru.wikisource.org/wiki/Сад_во_время_зимы_(Игнатий_Брянчанинов)",
      "rights_status": "public_domain_verified",
      "license_url": null,
      "copyright_notice": "Викитека указывает, что авторские произведения святителя Игнатия (Брянчанинова) находятся в общественном достоянии; поздние редакции/производные версии не считаются автоматически свободными.",
      "rights_evidence_url": "https://ru.wikisource.org/wiki/Автор:Игнатий_(Брянчанинов)",
      "source_url": "https://ru.wikisource.org/wiki/Сад_во_время_зимы_(Игнатий_Брянчанинов)"
    },
    {
      "key": "ignatius-obedience-to-elder",
      "title": "О жительстве в послушании у старца",
      "work_type": "theology",
      "author_key": "ignatius-brianchaninov",
      "author_name": "Святитель Игнатий (Брянчанинов)",
      "author_aliases": [
        "Игнатий Брянчанинов"
      ],
      "edition_title": "Викитека — электронная публикация",
      "language": "ru",
      "publisher": "Викитека",
      "publication_year": null,
      "asset_kind": "full_text",
      "storage_mode": "local_text",
      "external_url": "https://ru.wikisource.org/w/index.php?title=О_жительстве_в_послушании_у_старца_(Игнатий_Брянчанинов)&oldid=2626028#bodyContent",
      "rights_status": "open_license",
      "license_url": "https://creativecommons.org/licenses/by-sa/4.0/",
      "copyright_notice": "Оригинальный авторский текст — общественное достояние. Электронная транскрипция: участники Викитеки, CC BY-SA 4.0. Сохранены орфография и ошибки источника; удалены только навигация и элементы сайта. Полная выбранная электронная публикация, без заявления о критической выверке.",
      "rights_evidence_url": "https://ru.wikisource.org/w/index.php?title=О_жительстве_в_послушании_у_старца_(Игнатий_Брянчанинов)&oldid=2626028#bodyContent",
      "source_url": "https://ru.wikisource.org/w/index.php?title=О_жительстве_в_послушании_у_старца_(Игнатий_Брянчанинов)&oldid=2626028#bodyContent",
      "work_rights_status": "public_domain_verified",
      "local_source_file": "data/library_sources/texts/ignatius-obedience-to-elder.json",
      "content_path": "library/texts/ignatius-obedience-to-elder.txt",
      "content_sha256": "5dfe9a212b6145329f921f7004ef9196b907830ae22b7d218ea76704597b179c",
      "content_size_bytes": 16712,
      "source_revision": "2626028",
      "verified_on": "2026-10-05"